,Date,Location,Deaths,Injuries,Description,Suspects Deaths,Suspects Injuries,Total,dt,City,State,Location_,loc,loc_name,loc_coords,lat,long,Month,Year,Day
289,"August 24, 2006","Essex Junction, Vermont",2,3,"Christopher Williams, 26, shot his girlfriend's mother, Linda Lambesis, 57 at her home and from there he went to Essex Elementary School where Andrea, his girlfriend, worked. After he arrived at the elementary school, which was not in session at the time, he shot and killed Mary Alicia Shanks, 56, and shot Mary Snedeker, 52, nonfatally. He left the school and allegedly shot Chad Johansen, 26 nonfatally. He then turned the gun on himself, but did not die as a result.[371] Williams was sentenced to life in prison without parole in 2008.[372]",0,3,5,2006-08-24,Essex Junction,Vermont,"Essex Junction, Vermont","Essex Junction, Essex, Chittenden County, Vermont, USA","Essex Junction, Essex, Chittenden County, Vermont, USA","(44.489086, -73.1135030784832)",44.489086,-73.1135030784832,8,2006,24
290,"August 30, 2006","Hillsborough, North Carolina",1,2,"After shooting and killing his father, 18-year old teenager Alvaro Castillo went to his high school where he wounded two students. He was reportedly obsessed with the Columbine shootings and had written an email to the current Columbine high school principal before committing his own crime.[373] he was sentenced to life without parole.[374]",0,0,3,2006-08-30,Hillsborough,North Carolina,"Hillsborough, North Carolina","Hillsborough, Orange County, North Carolina, 27278, USA","Hillsborough, Orange County, North Carolina, 27278, USA","(36.0752297, -79.0992279)",36.0752297,-79.0992279,8,2006,30
291,"September 2, 2006","Shepherdstown, West Virginia",3,0,"49-year-old Douglas W. Pennington, killed himself and his two sons, 26-year-old Logan P. Pennington, 24-year-old Benjamin M. Pennington, during a visit to the campus of Shepherd University.[375][376]",3,0,3,2006-09-02,Shepherdstown,West Virginia,"Shepherdstown, West Virginia","Shepherdstown, Jefferson County, West Virginia, 25443, USA","Shepherdstown, Jefferson County, West Virginia, 25443, USA","(39.4300996, -77.804161)",39.4300996,-77.804161,9,2006,2
292,"September 17, 2006","Pittsburgh, Pennsylvania",0,5,"Five Duquesne basketball players were shot early Sunday morning during an apparent act of random violence on campus, leaving three hospitalized — two of them in critical condition.[377]",0,0,5,2006-09-17,Pittsburgh,Pennsylvania,"Pittsburgh, Pennsylvania","PGH, Allegheny County, Pennsylvania, USA","PGH, Allegheny County, Pennsylvania, USA","(40.4416941, -79.9900861)",40.4416941,-79.9900861,9,2006,17
293,"September 27, 2006","Bailey, Colorado",2,0,"Platte Canyon High School hostage crisis: 53-year-old drifter, Duane Roger Morrison, walked into Platte Canyon High School and took six girls hostage. During the ensuing siege, Morrison sexually assaulted all of the girls. When a SWAT team stormed the classroom, Morrison killed 16-year-old Emily Keyes, then took his own life after being shot and wounded by police.[378]",3,0,2,2006-09-27,Bailey,Colorado,"Bailey, Colorado","Bailey, Park County, Colorado, USA","Bailey, Park County, Colorado, USA","(39.4064662, -105.4717013)",39.4064662,-105.4717013,9,2006,27
294,"September 29, 2006","Cazenovia, Wisconsin",1,0,"Weston High School shooting: At around 8 a.m., 15-year-old freshman, Eric Hainstock, entered Weston High School. He aimed a 20-gauge shotgun at social studies teacher, Chuck Keller, before it was wrestled from him by school custodian, Dave Thompson. Hainstock then shot 49-year-old high school principal, John Alfred Klang, with a .22 caliber revolver. Klang died later that afternoon.[379][380] Hainstock was charged and convicted of murder, and is serving a life sentence. He will be eligible for parole in 2037.[217][381]",0,0,1,2006-09-29,Cazenovia,Wisconsin,"Cazenovia, Wisconsin","Cazenovia, Richland County, Wisconsin, USA","Cazenovia, Richland County, Wisconsin, USA","(43.5230345, -90.196238)",43.5230345,-90.196238,9,2006,29
295,"October 2, 2006","Nickel Mines, Pennsylvania",6,5,"West Nickel Mines School shooting: 32-year-old milk truck driver, Charles Carl Roberts IV, killed five Amish girls and wounded five others before killing himself in an Amish school in the hamlet of Nickel Mines, in Bart Township, Lancaster County.[382]",3,0,11,2006-10-02,Nickel Mines,Pennsylvania,"Nickel Mines, Pennsylvania","Nickel Mines Mission, Mine Road, Georgetown, Lancaster County, Pennsylvania, 17562, USA","Nickel Mines Mission, Mine Road, Georgetown, Lancaster County, Pennsylvania, 17562, USA","(39.9539915, -76.0807861)",39.9539915,-76.0807861,10,2006,2
296,"October 9, 2006","Joplin, Missouri",0,0,"13-year-old student Thomas White fired one shot from a Mac-90 rifle at a hallway ceiling at Memorial Middle School. The gunshot struck a water pipe, and nobody was injured. He also tried repeatedly to shoot principal Stephen Gilbreth at near-point-blank range as Gilbreth ushered him out of the school. Joplin police say the attempt was foiled by an improperly seated ammunition clip in the rifle. The principal was not injured. White was tried as an adult on charges of assault and firearms possession, and in 2009 he was sentenced to ten years of prison.[383]",0,0,0,2006-10-09,Joplin,Missouri,"Joplin, Missouri","Joplin, Jasper County, Missouri, USA","Joplin, Jasper County, Missouri, USA","(37.08418, -94.51323)",37.08418,-94.51323,10,2006,9
297,"January 3, 2007","Tacoma, Washington",1,0,"18-year-old student Douglas S. Chanthabouly, killed 17-year-old Samnang Kok, in the hallways of Henry Foss High School following a personal disagreement. In 2009, Chanthabouly was sentenced to 23 years in prison on a charge of second-degree murder.[384]",0,0,1,2007-01-03,Tacoma,Washington,"Tacoma, Washington","Tacoma, Pierce County, Washington, USA","Tacoma, Pierce County, Washington, USA","(47.2495798, -122.4398746)",47.2495798,-122.4398746,1,2007,3
298,"March 7, 2007","Compton, California",0,1,"During an argument with several non-students and students, a student was shot in the elbow and wounded in the eating area at Centennial High School. The shooting occurred an hour after classes were dismissed, and students in after-school activities were sent home.[385]",0,0,1,2007-03-07,Compton,California,"Compton, California","Compton, Los Angeles County, California, USA","Compton, Los Angeles County, California, USA","(33.894927, -118.226624)",33.894927,-118.226624,3,2007,7
299,"April 16, 2007","Blacksburg, Virginia",33,23,"Virginia Tech shooting: 23-year-old student, Seung-Hui Cho, armed with 2 pistols, a Glock 19 and a Walther P22, killed thirty-two students and faculty members at Virginia Tech, and wounded another seventeen students and faculty members in two separate attacks before committing suicide. The first attack was on the second floor of West Ambler Johnston Hall where he shot a young girl and another student that came to help. He then changed his clothes, and made multiple videos stating that he ""had to do it for his brothers and sisters."" He then made several pictures of himself with hammers, large knives, and guns. He then chained the doors of Norris Hall shut and shot and killed 30 more students and staff. He also shot 17 more students and staff wounding them. 6 more students were also wounded from non gunshot injuries. He was described as extremely quiet and lonely. During the rampage he wore a black T-shirt, a russet vest, a backwards baseball cap, black military cargo pants, black boots, and grip gloves. The incident is the 3rd deadliest shooting by a lone gunman in modern U.S. history and the deadliest school shooting in modern U.S. history.",3,0,56,2007-04-16,Blacksburg,Virginia,"Blacksburg, Virginia","Blacksburg, Montgomery County, Virginia, USA","Blacksburg, Montgomery County, Virginia, USA","(37.2296566, -80.4136767)",37.2296566,-80.4136767,4,2007,16
300,"September 21, 2007","Dover, Delaware",1,1,"Two 17-year-old Delaware State University freshmen were shot on campus. One died 32 days later on October 23, from critical injuries sustained in the attack. A suspected perpetrator, Loyer D. Braden, a freshman from East Orange, New Jersey, was arrested and charged with attempted murder; the charges were dismissed in May 2009.[386]",0,0,2,2007-09-21,Dover,Delaware,"Dover, Delaware","Dover, Kent County, Delaware, USA","Dover, Kent County, Delaware, USA","(39.158168, -75.5243682)",39.158168,-75.5243682,9,2007,21
301,"October 10, 2007","Cleveland, Ohio",1,5,"At SuccessTech alternative high school in downtown Cleveland, 14-year-old student Asa H. Coon shot two students and two teachers in the halls and classrooms on the fourth floor of the building. Coon then moved to another room on the same floor, where he fatally shot himself.[387]",3,0,6,2007-10-10,Cleveland,Ohio,"Cleveland, Ohio","Cleveland, Cuyahoga County, Ohio, USA","Cleveland, Cuyahoga County, Ohio, USA","(41.5051613, -81.6934446)",41.5051613,-81.6934446,10,2007,10
302,"January 23, 2008","Jonesboro, Arkansas",0,1,Arkansas State University offensive line-man 20-year Alfred Louis was grazed in the lower left leg when someone fired several rounds from a 9mm handgun at a residence hall. He was treated at a local hospital. Charges were later dismissed against the person accused of firing the shots.[388],0,0,1,2008-01-23,Jonesboro,Arkansas,"Jonesboro, Arkansas","Jonesboro, Craighead County, Arkansas, USA","Jonesboro, Craighead County, Arkansas, USA","(35.8428646, -90.7034522)",35.8428646,-90.7034522,1,2008,23
303,"February 4, 2008","Memphis, Tennessee",0,1,"At Hamilton High School, a student shot a 16-year-old student in the leg during a classroom argument over rap music. The victim's injury was not life-threatening.[389]",0,0,1,2008-02-04,Memphis,Tennessee,"Memphis, Tennessee","Memphis, Shelby County, Tennessee, USA","Memphis, Shelby County, Tennessee, USA","(35.1490215, -90.0516285)",35.1490215,-90.0516285,2,2008,4
304,"February 8, 2008","Baton Rouge, Louisiana",3,0,"Latina Williams, a 23-year-old nursing student at Louisiana Technical College killed two classmates and herself in a second floor classroom.[390]",3,0,3,2008-02-08,Baton Rouge,Louisiana,"Baton Rouge, Louisiana","Baton Rouge, East Baton Rouge Parish, Louisiana, USA","Baton Rouge, East Baton Rouge Parish, Louisiana, USA","(30.4459596, -91.18738)",30.4459596,-91.18738,2,2008,8
305,"February 11, 2008","Miami Gardens, Florida",0,1,"43-year-old 11th grade algebra teacher, Sergio Miranda, was shot by 19-year-old Patrick Lively, outside Miami Carol City Senior High School during a robbery but was expected to survive.[391][392] In 2011, Lively received a life sentence.[393]",0,0,1,2008-02-11,Miami Gardens,Florida,"Miami Gardens, Florida","Miami Gardens, Miami-Dade County, Florida, USA","Miami Gardens, Miami-Dade County, Florida, USA","(25.94207545, -80.2397528099553)",25.94207545,-80.2397528099553,2,2008,11
306,"February 11, 2008","Memphis, Tennessee",0,1,"Following a feud that started off campus earlier in the week, a 19-year-old senior was shot by a 17-year-old sophomore during a gym class held in the cafeteria with about 75 other students at Mitchell High School, before handing the gun to a coach making no attempt to flee. The victim suffered at least two gunshot wounds and was in critical condition, the suspected shooter was in custody. ""He walked up to him, shot him, and made a statement to the coach that 'It's over now,' "", said principal, Daniel Ware.[394]",0,0,1,2008-02-11,Memphis,Tennessee,"Memphis, Tennessee","Memphis, Shelby County, Tennessee, USA","Memphis, Shelby County, Tennessee, USA","(35.1490215, -90.0516285)",35.1490215,-90.0516285,2,2008,11
307,"February 12, 2008","Oxnard, California",1,0,"Murder of Larry King: 14-year-old Brandon McInerney, shot 15-year-old Lawrence ""Larry"" King, twice in the head in the computer laboratory of E.O. Green Junior High School. McInerney was apprehended in a nearby neighborhood. King, who was openly homosexual, died two days later. McInerney was initially charged with a hate crime, but that charge was dropped. McInerney pleaded guilty to second-degree murder and was sentenced to 21 years in prison.[395]",0,0,1,2008-02-12,Oxnard,California,"Oxnard, California","Oxnard, Ventura County, California, USA","Oxnard, Ventura County, California, USA","(34.1976308, -119.1803818)",34.1976308,-119.1803818,2,2008,12
308,"February 14, 2008","DeKalb, Illinois",6,21,"Northern Illinois University shooting: 27-year-old Steven Kazmierczak, shot multiple people with a shotgun in a classroom of Northern Illinois University, killing five and injuring 21, before taking his own life. Kazmierczak was not enrolled at the university, but had attended in the years prior to the attack.[396]",3,0,27,2008-02-14,DeKalb,Illinois,"DeKalb, Illinois","DeKalb, DeKalb County, Illinois, 60115, USA","DeKalb, DeKalb County, Illinois, 60115, USA","(41.9294736, -88.7503647)",41.9294736,-88.7503647,2,2008,14
309,"February 27, 2008","Little Rock, Arkansas",0,1,33-year old James Earl Matthews was shot in the stomach and buttocks as close range with a handgun on the University of Arkansas at little rock campus. He survived. Gerald Pride Jr. was sentenced to 20 years on multiple charges.[388],0,0,1,2008-02-27,Little Rock,Arkansas,"Little Rock, Arkansas","Little Rock, Arkansas, USA","Little Rock, Arkansas, USA","(34.7464809, -92.2895948)",34.7464809,-92.2895948,2,2008,27
310,"August 14, 2008","Federal Way, Washington",1,0,"26-year-old Omero Mendez was waiting at the Lakota Middle School campus to pick up his girlfriend's son. He was confronted by 16-year-old Luis F. Cosgaya-Alvarez and two of his friends, driving in an SUV. Cosgaya-Alvarez flashed gang signs at Mendez, and shot him once in the head. Mendez later died of his injuries. Cosgaya-Alvarez was arrested a few days later in Seattle and was charged with murder. Cosgaya-Alvarez pleaded guilty to murder and weapon enhancements, and was sentenced to eighteen years in prison.[397]",0,0,1,2008-08-14,Federal Way,Washington,"Federal Way, Washington","Federal Way, King County, Washington, USA","Federal Way, King County, Washington, USA","(47.313494, -122.3393103)",47.313494,-122.3393103,8,2008,14
311,"August 21, 2008","Knoxville, Tennessee",1,0,"At Central High School, 15-year-old Jamar Siler killed 15-year-old Ryan McDonald. In 2011, Siler was sentenced to thirty years in prison after pleading guilty to murder in a plea agreement.[151]",0,0,1,2008-08-21,Knoxville,Tennessee,"Knoxville, Tennessee","Knoxville, Knox County, Tennessee, USA","Knoxville, Knox County, Tennessee, USA","(35.9603948, -83.9210261)",35.9603948,-83.9210261,8,2008,21
312,"September 2, 2008","Willoughby, Ohio",0,0,"A 15-year-old student brought a handgun into South High School, and shot two rounds, one into the ceiling and one shattering a trophy case. The student then put the gun to his head. Then Assistant Principal Jeff Lyons talked the student out of doing any harm.",0,0,0,2008-09-02,Willoughby,Ohio,"Willoughby, Ohio","Willoughby, Lake County, Ohio, USA","Willoughby, Lake County, Ohio, USA","(41.6397696, -81.4065011)",41.6397696,-81.4065011,9,2008,2
313,"October 16, 2008","Detroit, Michigan",1,3,"16-year-old Christopher Walker, was killed, and three other teenagers were seriously wounded during a drive-by shooting near Henry Ford High School, soon after classes let out. Three teenagers were arrested and charged in connection with the shooting. The shooter, 15-year-old William Morton, was sentenced to life without parole, and Devon Bell was sentenced to forty-two years of prison.[398]",0,0,4,2008-10-16,Detroit,Michigan,"Detroit, Michigan","Detroit, Wayne County, Michigan, USA","Detroit, Wayne County, Michigan, USA","(42.3315509, -83.0466403)",42.3315509,-83.0466403,10,2008,16
314,"October 26, 2008","Conway, Arkansas",2,1,"University of Central Arkansas shootings: Four young men fatally shot two students, 18-year-old Ryan Henderson, and 19-year-old Chavares Block, and wounded a 19-year-old campus visitor in the leg, outside the Arkansas Hall dormitory of University of Central Arkansas.[399]",0,0,3,2008-10-26,Conway,Arkansas,"Conway, Arkansas","Conway, Faulkner County, Arkansas, USA","Conway, Faulkner County, Arkansas, USA","(35.0886963, -92.4421011)",35.0886963,-92.4421011,10,2008,26
315,"November 12, 2008","Fort Lauderdale, Florida",1,0,"15-year-old Amanda Collette, was killed in the hallway at Dillard High School. The shooter, 15-year-old Teah Wimberly, was sentenced to twenty-five years to life on a first-degree murder charge.[400]",0,0,1,2008-11-12,Fort Lauderdale,Florida,"Fort Lauderdale, Florida","Fort Lauderdale, Broward County, Florida, USA","Fort Lauderdale, Broward County, Florida, USA","(26.1223084, -80.1433786)",26.1223084,-80.1433786,11,2008,12
316,"January 9, 2009","Chicago, Illinois",0,5,"After attendees were leaving a basketball game at Dunbar High School, a truck pulled over and someone inside fired shots at the crowd, wounding five people, three critically. 18-year-old Georgio Dukes, was arrested and charged a week later with five counts of felony aggravated battery with a firearm. Police believe that the attack was gang-related.[401]",0,0,5,2009-01-09,Chicago,Illinois,"Chicago, Illinois","Chicago, Cook County, Illinois, USA","Chicago, Cook County, Illinois, USA","(41.8755616, -87.6244212)",41.8755616,-87.6244212,1,2009,9
317,"April 26, 2009","Hampton, Virginia",0,3,"18-year-old Odane Greg Maye, a former student of Hampton University, followed a 43-year-old pizza delivery man into his former dormitory. Armed with three guns, Maye wounded the delivery man, then the dorm monitor. Lastly, Maye shot himself in a suicide attempt. He survived and was convicted of two charges of malicious wounding, two counts of using a gun in a felony; burglary; and shooting in an occupied building. He was sentenced to fourteen years of prison in November 2009, and was ordered by a judge to pay more than $62,000 in restitution to his victims for lost wages.[402]",0,0,3,2009-04-26,Hampton,Virginia,"Hampton, Virginia","Hampton, Hampton City, Virginia, 23669-4019, USA","Hampton, Hampton City, Virginia, 23669-4019, USA","(37.0300969, -76.3452057)",37.0300969,-76.3452057,4,2009,26
318,"May 18, 2009","Cambridge, Massachusetts",1,0,"20-year-old Jabrai Copney, 23-year-old Jason Aquino, and 19-year-old Blayn Jiggetts, of New York City, invited 21-year-old Justin Cosby, of Cambridge, into a Harvard College dormitory. After trying to rob him of a pound of marijuana, they shot him. The victim, Cosby, was pronounced dead early the next day. Copney turned himself in three days later, and was convicted of murder. His partners pleaded guilty to armed robbery and manslaughter. His girlfriend, 21-year-old Brittany Smith, pleaded guilty to accessory after the fact, firearm possession, and misleading a grand jury.[403]",0,0,1,2009-05-18,Cambridge,Massachusetts,"Cambridge, Massachusetts","Cambridge, Middlesex County, Massachusetts, USA","Cambridge, Middlesex County, Massachusetts, USA","(42.3750997, -71.1056157)",42.3750997,-71.1056157,5,2009,18
319,"May 18, 2009","Larose, Louisiana",1,0,"15-year-old Larose-Cut Off Middle School student, Justin Doucet, carried his backpack to a restroom, where he put on camouflage clothes and took out a semi-automatic handgun before storming into a nearby classroom. He attempted to shoot a teacher, Jessica Plaisance, but the gun did not fire. He returned to the restroom and shot himself in the head, dying a week later of his wounds.[404][405]",3,0,1,2009-05-18,Larose,Louisiana,"Larose, Louisiana","Larose, Lafourche Parish, Louisiana, 70373, USA","Larose, Lafourche Parish, Louisiana, 70373, USA","(29.572438, -90.3817483)",29.572438,-90.3817483,5,2009,18
320,"June 16, 2009","San Francisco, California",0,3,"After students were being let out of International Studies Academy on the first day of summer school classes, a man left a car and opened fire, wounding three people, including a 17-year-old female student. An 18-year-old man was arrested for being an accessory in the crime.[406]",0,0,3,2009-06-16,San Francisco,California,"San Francisco, California","SF, California, USA","SF, California, USA","(37.7792808, -122.4192363)",37.7792808,-122.4192363,6,2009,16
321,"September 3, 2009","San Bruno, California",0,1,"A 20-year-old student was wounded in the parking lot of Skyline College after an argument between him and other men. The college campus was placed on lockdown. Three San Francisco residents, 18-year-old Germaine B. Benjamin, 20-year-old Dimaryea J. McGhee, and 18-year-old Jacori W. Bender, were each arrested and charged with felony firearm offenses.[407]",0,0,1,2009-09-03,San Bruno,California,"San Bruno, California","San Bruno, San Mateo County, California, USA","San Bruno, San Mateo County, California, USA","(37.6304904, -122.4110835)",37.6304904,-122.4110835,9,2009,3
322,"February 5, 2010","Madison, Alabama",1,0,"14-year-old student, Hammad Memon, killed 14-year-old Todd Brown at Discovery Middle School as classes were changing. The shooting was possibly related to gang activity. In May 2013, Memon pleaded guilty to the murder and was sentenced to thirty years of prison. After Memon is released from prison, he is likely to be deported to his native Pakistan.[408]",0,0,1,2010-02-05,Madison,Alabama,"Madison, Alabama","Madison County, Alabama, USA","Madison County, Alabama, USA","(34.7736807, -86.5675095)",34.7736807,-86.5675095,2,2010,5
323,"February 12, 2010","Huntsville, Alabama",3,3,"University of Alabama in Huntsville shooting: 44-year-old biology professor, Amy Bishop, killed the chairman of the biology department, 52-year-old Gopi K. Podila, and biology professors, 50-year-old, Maria Ragland Davis and 52-year-old Adriel D. Johnson. She also wounded biology professors, Luis Rogelio Cruz-Vera and Joseph G. Leahy, and staff assistant, Stephanie Monticciolo.[409] Bishop was sentenced to life without parole.",0,0,6,2010-02-12,Huntsville,Alabama,"Huntsville, Alabama","Huntsville, Madison County, Alabama, USA","Huntsville, Madison County, Alabama, USA","(34.6686435, -86.4418197139765)",34.6686435,-86.4418197139765,2,2010,12
324,"February 19, 2010","DeKalb, Illinois",0,1,"Less than a week after Northern Illinois University solemnly marked the second anniversary of a mass shooting on campus that claimed the lives of five students, the DeKalb school was the scene of further gun violence. 24-year-old NIU student, Brian Mulder, refused entry to 22-year-old Zachary R. Isaacman, when he had tried to follow a female resident into the Stevenson Residence Hall North, where they were living, because he was not a resident. Moments later, while outside the dorm smoking with a friend, Mulder was shot by Isaacman, with a handgun in the leg above the knee. Isaacman tried to flee, but was caught by police within minutes.[410]",0,0,1,2010-02-19,DeKalb,Illinois,"DeKalb, Illinois","DeKalb, DeKalb County, Illinois, 60115, USA","DeKalb, DeKalb County, Illinois, 60115, USA","(41.9294736, -88.7503647)",41.9294736,-88.7503647,2,2010,19
325,"February 23, 2010","Littleton, Colorado",0,2,"At Deer Creek Middle School, 32-year-old Bruco Strong Eagle Eastwood opened fire from a rifle in a parking lot, and wounded two eighth-graders Reagan Webber and Matt Thieu, before being restrained by 57-year-old Math teacher, David Benke, and held until his arrest. The boy's wounds were critical for the four days following the shooting.[411] In October 2011, Eastwood was found not guilty by reason of insanity.[412][409]",0,0,2,2010-02-23,Littleton,Colorado,"Littleton, Colorado","Littleton, Arapahoe County, Colorado, USA","Littleton, Arapahoe County, Colorado, USA","(39.613321, -105.0166498)",39.613321,-105.0166498,2,2010,23
326,"March 9, 2010","Columbus, Ohio",2,1,"51-year-old Ohio State University custodian, Nathaniel Brown, killed a co-worker and wounded another before committing suicide.[409]",3,0,3,2010-03-09,Columbus,Ohio,"Columbus, Ohio","Columbus, Franklin County, Ohio, USA","Columbus, Franklin County, Ohio, USA","(39.9622601, -83.0007065)",39.9622601,-83.0007065,3,2010,9
327,"May 11, 2010","Bladenboro, North Carolina",0,1,A West Bladen High School student was shot on campus as students were leaving school for the day. Investigators said the incident started when a fight broke out between two groups of students near the high school's entrance.[413],0,0,1,2010-05-11,Bladenboro,North Carolina,"Bladenboro, North Carolina","Bladenboro, Bladen County, North Carolina, USA","Bladenboro, Bladen County, North Carolina, USA","(34.5386768, -78.7875887)",34.5386768,-78.7875887,5,2010,11
328,"September 8, 2010","Detroit, Michigan",0,2,"Two students were wounded in front of Mumford High School by 17-year-old Steven Jamal Hare. He was tried as an adult and charged with assault with intent to kill. In 2012, Hare was sentenced to 27 years in prison.[414]",0,0,2,2010-09-08,Detroit,Michigan,"Detroit, Michigan","Detroit, Wayne County, Michigan, USA","Detroit, Wayne County, Michigan, USA","(42.3315509, -83.0466403)",42.3315509,-83.0466403,9,2010,8
329,"September 28, 2010","Austin, Texas ",1,1,"A 19-year-old sophomore student Colton Tooley, wielding an AK-47 and wearing a ski mask, opened fire and then killed himself in a University of Texas library[415]",3,0,2,2010-09-28,Austin,Texas,"Austin, Texas","Austin, Travis County, Texas, United States of America","Austin, Travis County, Texas, United States of America","(30.2711286, -97.7436995)",30.2711286,-97.7436995,9,2010,28
