,Date,Location,Deaths,Injuries,Description,Suspects Deaths,Suspects Injuries,Total,dt,City,State,Location_,loc,loc_name,loc_coords,lat,long,Month,Year,Day
371,"November 13, 2013","Pittsburgh, Pennsylvania",0,3,"After classes ended, at least one gunman came out of the woods and opened fire on three students as they were walking to their cars at Brashear High School. One student was grazed in the head, another was struck in the neck and shoulder, and a third was hit in the leg and foot. Six people were taken into custody. The shooting is believed to be drug-related.[468]",0,0,3,2013-11-13,Pittsburgh,Pennsylvania,"Pittsburgh, Pennsylvania","PGH, Allegheny County, Pennsylvania, USA","PGH, Allegheny County, Pennsylvania, USA","(40.4416941, -79.9900861)",40.4416941,-79.9900861,11,2013,13
372,"December 4, 2013","Winter Garden, Florida",0,1,"A 15-year-old student was wounded by a 17-year-old student near a soccer field on the campus of West Orange High School. The shooting occurred after a fight broke out between the two students. The 17-year-old suspected shooter was taken into custody several miles away from the school, and is charged with attempted murder, aggravated battery with a firearm, possession of a firearm by a minor and possession of a firearm on school grounds. In October 2014, the shooter was sentenced to twenty-five years in prison.[469]",0,0,1,2013-12-04,Winter Garden,Florida,"Winter Garden, Florida","Winter Garden, Orange County, Florida, 34787, USA","Winter Garden, Orange County, Florida, 34787, USA","(28.5502685, -81.5925974608596)",28.5502685,-81.5925974608596,12,2013,4
373,"December 13, 2013","Centennial, Colorado",2,0,"18-year-old Karl Pierson, shot 17-year-old student Claire Davis in the head, fatally injuring her, in a hallway in Arapahoe High School. Pierson then took his own life.[429] Pierson was armed with a shotgun, three Molotov cocktails, and a machete. His intention was to shoot the librarian who had disciplined him. Claire Davis died from her injuries on December 21, 2013.[470]",3,0,2,2013-12-13,Centennial,Colorado,"Centennial, Colorado","Centennial, Arapahoe County, Colorado, USA","Centennial, Arapahoe County, Colorado, USA","(39.5680644, -104.97783081285)",39.5680644,-104.97783081285,12,2013,13
374,"December 19, 2013","Fresno, California",0,1,"Four teens (16, 16, 16 and 17 years old) entered Edison High School in what was believed as a gang-initiation process. After accosting a 62-year-old woman about a mile away from school grounds, they found an athletic trainer who taught at Edison High and shot him several times in the leg and stomach.[471]",0,0,1,2013-12-19,Fresno,California,"Fresno, California","Fresno, Fresno County, California, USA","Fresno, Fresno County, California, USA","(36.7295295, -119.708861260756)",36.7295295,-119.708861260756,12,2013,19
375,"January 9, 2014","Jackson, Tennessee",0,1,A 16-year-old student was charged with bringing a gun to school at Liberty Technology Magnet High School and shooting a classmate in the thigh. The incident occurred outside the front of the school.[472],0,0,1,2014-01-09,Jackson,Tennessee,"Jackson, Tennessee","Jackson, Madison County, Tennessee, USA","Jackson, Madison County, Tennessee, USA","(35.6144446, -88.8177418)",35.6144446,-88.8177418,1,2014,9
376,"January 13, 2014","New Haven, Connecticut",0,1,"A 14-year-old boy was shot outside of a basketball game at the Hillhouse High School athletic facility, suffering wounds in his hand and leg.[cite]",0,0,1,2014-01-13,New Haven,Connecticut,"New Haven, Connecticut","New Haven, New Haven County, Connecticut, USA","New Haven, New Haven County, Connecticut, USA","(41.3082138, -72.9250518)",41.3082138,-72.9250518,1,2014,13
377,"January 14, 2014","Roswell, New Mexico",0,3,"Two people were wounded inside the gymnasium of Berrendo Middle School, at about 8:10 a.m.. An 11-year-old boy and a 13-year-old girl were airlifted to a hospital in Lubbock, Texas in critical condition. The 12-year-old suspected shooter, Mason Campbell, a seventh grade student, was apprehended at the scene after he was talked down by a staff member and dropped the shotgun. A staff member received minor injuries. Campbell was charged with three counts of aggravated battery with a deadly weapon. He was sentenced to a maximum sentence of confinement in a juvenile detention facility until he is twenty one years old.[473]",0,0,3,2014-01-14,Roswell,New Mexico,"Roswell, New Mexico","Roswell, Chaves County, New Mexico, USA","Roswell, Chaves County, New Mexico, USA","(33.3943282, -104.5229518)",33.3943282,-104.5229518,1,2014,14
378,"January 17, 2014","Philadelphia, Pennsylvania",0,2,"A student allegedly shot two other students in the gymnasium at Delaware Valley Charter School. Both victims, a male and a female, were shot in the arm. They were taken to a nearby hospital and are in stable condition, police say. Police Commissioner Charles Ramsey said at a news conference that the shooter ran out of the school after the shooting but was taken into custody near his home. 17-year-old Raisheem Rochwell was arrested and charged as an adult for aggravated assault, recklessly endangering another person and firearms offenses. Rochwell was sentenced to two years of juvenile detention.[474]",0,0,2,2014-01-17,Philadelphia,Pennsylvania,"Philadelphia, Pennsylvania","Philadelphia, Philadelphia County, Pennsylvania, USA","Philadelphia, Philadelphia County, Pennsylvania, USA","(39.9527237, -75.1635262)",39.9527237,-75.1635262,1,2014,17
379,"January 20, 2014","Chester, Pennsylvania",0,1,One person was critically injured at Widener University. The incident occurred around 10 p.m. outside the university sport's complex and led to an 8-hour university lock-down. The suspect was not immediately found.[475],0,0,1,2014-01-20,Chester,Pennsylvania,"Chester, Pennsylvania","Chester, Delaware County, Pennsylvania, 19013, USA","Chester, Delaware County, Pennsylvania, 19013, USA","(39.849557, -75.3557458)",39.849557,-75.3557458,1,2014,20
380,"January 21, 2014","West Lafayette, Indiana",1,0,"A 21-year-old student, Andrew Boldt, was killed in a classroom building on the campus of Purdue University. 24-year-old student Cody Cousins was found guilty of the murder and was sentenced to sixty-five years of prison. In October 2014, Cousins committed suicide in his cell.[476]",0,0,1,2014-01-21,West Lafayette,Indiana,"West Lafayette, Indiana","West Lafayette, Tippecanoe County, Indiana, USA","West Lafayette, Tippecanoe County, Indiana, USA","(40.4258686, -86.9080655)",40.4258686,-86.9080655,1,2014,21
381,"January 24, 2014","Orangeburg, South Carolina",1,0,A 20-year-old student was killed at South Carolina State University. A 19-year-old was arrested and charged with murder.[477],0,0,1,2014-01-24,Orangeburg,South Carolina,"Orangeburg, South Carolina","Orangeburg, Orangeburg County, South Carolina, USA","Orangeburg, Orangeburg County, South Carolina, USA","(33.4918203, -80.8556476)",33.4918203,-80.8556476,1,2014,24
382,"January 25, 2014","Los Angeles, California",1,0,A man was killed at Los Angeles Valley College. Two suspects were arrested in the fatal shooting.[478],0,0,1,2014-01-25,Los Angeles,California,"Los Angeles, California","LA, Los Angeles County, California, United States of America","LA, Los Angeles County, California, United States of America","(34.0536909, -118.2427666)",34.0536909,-118.2427666,1,2014,25
383,"January 27, 2014","Carbondale, Illinois",0,1,A group of students at Rebound High School got in an argument in the school's parking lot. One student pulled out a gun and shot another student in the ensuing altercation. An 18-year-old suspect is facing charges of attempted murder.[479],0,0,1,2014-01-27,Carbondale,Illinois,"Carbondale, Illinois","Carbondale, Jackson County, Illinois, USA","Carbondale, Jackson County, Illinois, USA","(37.7274692, -89.216655)",37.7274692,-89.216655,1,2014,27
384,"January 28, 2014","Nashville, Tennessee",0,1,One student was shot in the leg in an apparent altercation over a gambling debt at Tennessee State University.[480],0,0,1,2014-01-28,Nashville,Tennessee,"Nashville, Tennessee","Nashville-Davidson, Davidson County, Tennessee, USA","Nashville-Davidson, Davidson County, Tennessee, USA","(36.1622296, -86.7743531)",36.1622296,-86.7743531,1,2014,28
385,"January 30, 2014","Palm Bay, Florida",0,1,Three students were fighting in a parking lot of Eastern Florida State College and one pulled out a gun and shot another of the students. All three students claimed self-defense.[481],0,0,1,2014-01-30,Palm Bay,Florida,"Palm Bay, Florida","Palm Bay, Brevard County, Florida, USA","Palm Bay, Brevard County, Florida, USA","(28.0331886, -80.6429695)",28.0331886,-80.6429695,1,2014,30
386,"January 31, 2014","Des Moines, Iowa",0,1,"After a basketball game at North High School, there was gunfire in a parking lot of the school. Six males in a black jeep had come moments before the shooting and returned at the time it happened. A 15-year-old girl was injured by a ricocheting bullet. While officers were gaining control of the area, teachers on the scene led students into the school building for safety.[482]",0,0,1,2014-01-31,Des Moines,Iowa,"Des Moines, Iowa","Des Moines, Polk County, Iowa, USA","Des Moines, Polk County, Iowa, USA","(41.5910641, -93.6037149)",41.5910641,-93.6037149,1,2014,31
387,"February 10, 2014","Salisbury, North Carolina",0,1,"A 16-year-old student was shot in the stomach on the campus of Salisbury High School during a dispute in the school gym. 17-year-old suspect was charged with assault with a deadly weapon with intent to kill inflicting serious injury, possession of a firearm on school property and discharging a weapon on school property.[483]",0,0,1,2014-02-10,Salisbury,North Carolina,"Salisbury, North Carolina","Salisbury, Rowan County, North Carolina, USA","Salisbury, Rowan County, North Carolina, USA","(35.6709727, -80.4742261)",35.6709727,-80.4742261,2,2014,10
388,"February 10, 2014","Lyndhurst, Ohio",0,0,"Five shots were fired in the parking lot of Charles F. Brush High School, including one which hit an unoccupied police car. No one was reported to be injured, though a school basketball game was going on at the time.[484]",0,0,0,2014-02-10,Lyndhurst,Ohio,"Lyndhurst, Ohio","Lyndhurst, Cuyahoga County, Ohio, 44124, USA","Lyndhurst, Cuyahoga County, Ohio, 44124, USA","(41.520052, -81.488732)",41.520052,-81.488732,2,2014,10
389,"February 12, 2014","Los Angeles, California",0,1,A male victim was shot in the back in a possible gang-related drive-by shooting near the University of Southern California. The suspect fled into the University Campus. The victim was last reported in stable condition before being transported to a local hospital.[485],0,0,1,2014-02-12,Los Angeles,California,"Los Angeles, California","LA, Los Angeles County, California, United States of America","LA, Los Angeles County, California, United States of America","(34.0536909, -118.2427666)",34.0536909,-118.2427666,2,2014,12
390,"February 22, 2014","Augusta, Georgia",0,1,"A shooting involving a campus police officer occurred at a Georgia Regents University dormitory complex. A male suspect entered a vehicle and nearly struck an officer, who opened fire. The suspect was taken to Georgia Regents Medical Center with injuries that were not believed to be critical.[486]",0,0,1,2014-02-22,Augusta,Georgia,"Augusta, Georgia","Augusta, Richmond County, Georgia, 30901, USA","Augusta, Richmond County, Georgia, 30901, USA","(33.4709714, -81.9748429)",33.4709714,-81.9748429,2,2014,22
391,"March 25, 2014","College Park, Georgia",0,0,"An argument between students led to shots being fired in a Benjamin Banneker High School parking lot during the afternoon. Investigators believe multiple people were present when shots were fired, but it was not known how many could face charges for the incident. No one was injured in the shooting.[487]",0,0,0,2014-03-25,College Park,Georgia,"College Park, Georgia","College Park, Fulton County, Georgia, United States of America","College Park, Fulton County, Georgia, United States of America","(33.6534427, -84.4493725)",33.6534427,-84.4493725,3,2014,25
392,"April 11, 2014","Detroit, Michigan",1,0,"After a Friday evening student awards ceremony called ""Grammy Night"", four men who were affiliated with a gang fired into a crowd in the parking lot of East English Village Preparatory Academy. One 19-year-old, Darryl Smith, was fatally shot in the head. Smith was not a student at the academy.[488]",0,0,1,2014-04-11,Detroit,Michigan,"Detroit, Michigan","Detroit, Wayne County, Michigan, USA","Detroit, Wayne County, Michigan, USA","(42.3315509, -83.0466403)",42.3315509,-83.0466403,4,2014,11
393,"May 4, 2014","Augusta, Georgia",0,1,"Two men fired shots inside a dormitory at Paine College on Sunday, injuring one student in the head. Neither of the suspects were students at the college.[489]",0,0,1,2014-05-04,Augusta,Georgia,"Augusta, Georgia","Augusta, Richmond County, Georgia, 30901, USA","Augusta, Richmond County, Georgia, 30901, USA","(33.4709714, -81.9748429)",33.4709714,-81.9748429,5,2014,4
394,"May 5, 2014","Augusta, Georgia",0,1,An active shooter situation was reported at Paine College on Monday with one person reported to be shot. The suspect was apparently apprehended and in custody. It was the second shooting incident to occur at the college campus in two days.[490],0,0,1,2014-05-05,Augusta,Georgia,"Augusta, Georgia","Augusta, Richmond County, Georgia, 30901, USA","Augusta, Richmond County, Georgia, 30901, USA","(33.4709714, -81.9748429)",33.4709714,-81.9748429,5,2014,5
395,"May 8, 2014","Lawrenceville, Georgia",0,1,"A person was shot on a student parking lot roof at Georgia Gwinnett College, receiving an injury. The specific cause has not been identified.[491]",0,0,1,2014-05-08,Lawrenceville,Georgia,"Lawrenceville, Georgia","Lawrenceville, Gwinnett County, Georgia, USA","Lawrenceville, Gwinnett County, Georgia, USA","(33.9562149, -83.9879625)",33.9562149,-83.9879625,5,2014,8
396,"May 14, 2014","Richmond, California",0,1,A 14-year-old student was injured during a drive-by shooting in front of John F. Kennedy High School at 8:30 a.m.. He was shot as he was running towards the school campus after a fight took place. The student suffered a serious but stable injury to his leg. Police are searching for a suspect.[492],0,0,1,2014-05-14,Richmond,California,"Richmond, California","Richmond, Contra Costa County, California, USA","Richmond, Contra Costa County, California, USA","(37.9357576, -122.3477486)",37.9357576,-122.3477486,5,2014,14
397,"June 5, 2014","Seattle, Washington",1,3,"19-year-old students, Paul Lee and Sarah Williams, and 24-year-old student, Thomas Fowler, were shot inside a hallway of Otto Miller Hall at Seattle Pacific University.[493] Freshman Lee was rushed to Harborview Medical Center but later died. The shooter was subdued with pepper spray and tackled to the ground by student building monitor, Jon Meis, as he paused to reload his shotgun. 26-year-old Aaron Rey Ybarra was arrested at the scene and has been charged with premeditated and attempted murder.[494]",0,0,4,2014-06-05,Seattle,Washington,"Seattle, Washington","Seattle, King County, Washington, United States of America","Seattle, King County, Washington, United States of America","(47.6038321, -122.3300624)",47.6038321,-122.3300624,6,2014,5
398,"June 10, 2014","Troutdale, Oregon",2,1,"At around 8:30 a.m. shots were fired at Reynolds High School. 14-year-old freshman Emilio Hoffman was killed, a physical education teacher was injured, and the gunman, 15-year-old Jared Padgett, exchanged gunfire with police officers and then committed suicide in a restroom stall.[429][495]",3,0,3,2014-06-10,Troutdale,Oregon,"Troutdale, Oregon","Troutdale, Multnomah County, Oregon, 97060, USA","Troutdale, Multnomah County, Oregon, 97060, USA","(45.5317928, -122.391155)",45.5317928,-122.391155,6,2014,10
399,"September 9, 2014","Miami, Florida",0,1,"Towards the end of the school day, one alternative school student in Miami was shot as a small group of students tussled. The injury was minor, requiring hospitalization, and five young adults were later questioned.[496]",0,0,1,2014-09-09,Miami,Florida,"Miami, Florida","Miami, Miami-Dade County, Florida, USA","Miami, Miami-Dade County, Florida, USA","(25.7742658, -80.1936589)",25.7742658,-80.1936589,9,2014,9
400,"September 11, 2014","Taylorsville, Utah",0,1,"An elementary school teacher with a concealed weapon permit had her gun fire accidentally in a faculty bathroom. The bullet shattered a toilet, and fragments of both the bullet and the porcelain injured her leg.[497]",0,0,1,2014-09-11,Taylorsville,Utah,"Taylorsville, Utah","Taylorsville, Salt Lake County, Utah, USA","Taylorsville, Salt Lake County, Utah, USA","(40.6677096, -111.9385867)",40.6677096,-111.9385867,9,2014,11
401,"September 27, 2014","Terre Haute, Indiana",0,1,"A 20-year-old Indiana State University student was shot by another student on Saturday inside a residence hall. The injuries were not fatal, and a full recovery was expected. The shooter was arrested on the following day.[498]",0,0,1,2014-09-27,Terre Haute,Indiana,"Terre Haute, Indiana","Terre Haute, Vigo County, Indiana, USA","Terre Haute, Vigo County, Indiana, USA","(39.4667025, -87.4139119)",39.4667025,-87.4139119,9,2014,27
402,"September 30, 2014","Albemarle, North Carolina",0,1,"Two students got in an argument at Albemarle High School around 7:30 a.m. on Tuesday, and one of the students shot the other twice including once in the leg. The student who committed the shooting was allegedly involved in a stabbing of a football player last year at West Montgomery High School, which is only 20 miles (32 km) away in Mount Gilead, North Carolina. The school had held an active shooter training over the summer, which prepared the school for this incident.[499]",0,0,1,2014-09-30,Albemarle,North Carolina,"Albemarle, North Carolina","Albemarle, Stanly County, North Carolina, 28001, USA","Albemarle, Stanly County, North Carolina, 28001, USA","(35.3501426, -80.2000578)",35.3501426,-80.2000578,9,2014,30
403,"September 30, 2014","Louisville, Kentucky",0,1,"One student was injured at Fern Creek Traditional High School. The incident occurred around 1 p.m., reportedly after student became enraged in a hallway and pulled out a gun. The student was arrested later that day.[500]",0,0,1,2014-09-30,Louisville,Kentucky,"Louisville, Kentucky","Louisville, Jefferson County, Kentucky, USA","Louisville, Jefferson County, Kentucky, USA","(38.2542376, -85.759407)",38.2542376,-85.759407,9,2014,30
404,"October 3, 2014","Fairburn, Georgia",1,0,"After a homecoming football game, a fatal shooting of 17-year-old Kristofer Hunter, occurred in the Langston Hughes High School parking lot. The assailant, 18-year-old Eric Dana Johnson Jr., turned himself in a week later.[501]",0,0,1,2014-10-03,Fairburn,Georgia,"Fairburn, Georgia","Fairburn, Fulton County, Georgia, 30213, USA","Fairburn, Fulton County, Georgia, 30213, USA","(33.5670562, -84.5810418)",33.5670562,-84.5810418,10,2014,3
405,"October 24, 2014","Marysville, Washington",5,1,"Marysville Pilchuck High School shooting. 15-year-old freshman, Jaylen Fryberg, shot five students in the school cafeteria of Marysville Pilchuck High School, fatally wounding four, before committing suicide.[429][502]",3,0,6,2014-10-24,Marysville,Washington,"Marysville, Washington","Marysville, Snohomish County, Washington, USA","Marysville, Snohomish County, Washington, USA","(48.0517429, -122.1768209)",48.0517429,-122.1768209,10,2014,24
406,"November 20, 2014","Tallahassee, Florida",1,3,"At around 12:40 a.m. EST, a gunman opened fired in or near the Strozier Library at Florida State University. Three people suffered gunshot injuries and were taken to a local area hospital. One was in critical condition, another was in good condition, and the third was shortly released after treatment. The gunman, later identified as Myron May, an alumnus from the school, started firing towards responding police officers and was fatally shot by them on the steps of the library.[503]",3,0,4,2014-11-20,Tallahassee,Florida,"Tallahassee, Florida","Tallahassee, Leon County, Florida, USA","Tallahassee, Leon County, Florida, USA","(30.4380832, -84.2809332)",30.4380832,-84.2809332,11,2014,20
407,"November 20, 2014","Miami, Florida",1,1,Two teens were shot during a fight at Miami Carol City High School. One of the boys died.[504],0,0,2,2014-11-20,Miami,Florida,"Miami, Florida","Miami, Miami-Dade County, Florida, USA","Miami, Miami-Dade County, Florida, USA","(25.7742658, -80.1936589)",25.7742658,-80.1936589,11,2014,20
408,"December 12, 2014","Portland, Oregon",0,4,"Rosemary Anderson High School shooting: A gunman shot three students and a man outside Rosemary Anderson High School in north Portland. A 16-year-old girl was in critical condition, while the others suffered minor injuries. Two men, aged eighteen and twenty-two, were arrested in connection with the shooting.[505]",0,0,4,2014-12-12,Portland,Oregon,"Portland, Oregon","Portland, Multnomah County, Oregon, USA","Portland, Multnomah County, Oregon, USA","(45.5202471, -122.6741949)",45.5202471,-122.6741949,12,2014,12
409,"January 15, 2015","Milwaukee, Wisconsin",0,3,"A 15-year-old boy, a student's father, and a teacher were each injured in the school parking lot at Wisconsin Lutheran High School. The student had unspecified injuries that were treated. The father was shot in the knee and the teacher was grazed in the toe. A 36-year-old man was charged in the shooting.[506]",0,0,3,2015-01-15,Milwaukee,Wisconsin,"Milwaukee, Wisconsin","Milwaukee, Milwaukee County, Wisconsin, United States of America","Milwaukee, Milwaukee County, Wisconsin, United States of America","(43.0349931, -87.922497)",43.0349931,-87.922497,1,2015,15
410,"January 16, 2015","Ocala, Florida",0,2,"Two were injured in gunfire that occurred after a Friday night basketball game. One was injured directly by a bullet, the other by ricocheting glass.[507]",0,0,2,2015-01-16,Ocala,Florida,"Ocala, Florida","Ocala, Marion County, Florida, USA","Ocala, Marion County, Florida, USA","(29.1871986, -82.1400923)",29.1871986,-82.1400923,1,2015,16
411,"February 4, 2015","Frederick, Maryland",0,2,"Two students were shot near the gymnasium of Frederick High School during a junior varsity (JV) boys' basketball game. Approximately two hundred students, staff, and faculty were placed on lockdown for several hours after the shooting while police searched for the suspects. No suspects have been apprehended, although witnesses report seeing four black males dressed all in black who are considered by police to be suspects in this shooting.[508]",0,0,2,2015-02-04,Frederick,Maryland,"Frederick, Maryland","Frederick, Frederick County, Maryland, USA","Frederick, Frederick County, Maryland, USA","(39.4142186, -77.4109269)",39.4142186,-77.4109269,2,2015,4
412,"February 14, 2015","Merced, California",1,0,A teenager was found dead in the parking lot of Tenaya Middle School. The shooting was reported to have occurred after school hours.[509],0,0,1,2015-02-14,Merced,California,"Merced, California","Merced, Merced County, California, USA","Merced, Merced County, California, USA","(37.3029568, -120.4843269)",37.3029568,-120.4843269,2,2015,14
413,"February 23, 2015","Daytona Beach, Florida",0,3,"Two students argued outside the music building at Bethune-Cookman University when one pulled out a gun. Both had guns and it is not disclosed who did the shooting, injuring three students. A reward was offered to help solve this case.[510]",0,0,3,2015-02-23,Daytona Beach,Florida,"Daytona Beach, Florida","Daytona Beach, Volusia County, Florida, USA","Daytona Beach, Volusia County, Florida, USA","(29.2108147, -81.0228331)",29.2108147,-81.0228331,2,2015,23
414,"March 30, 2015","University City, Missouri",0,1,"Police said one person has been arrested for a shooting at Pershing Elementary School. The shooting occurred in the parking lot, with a 34-year-old-man being shot in the buttocks.[511]",0,0,1,2015-03-30,University City,Missouri,"University City, Missouri","U. City, Saint Louis County, Missouri, 63130, USA","U. City, Saint Louis County, Missouri, 63130, USA","(38.6569083, -90.3103443)",38.6569083,-90.3103443,3,2015,30
415,"April 13, 2015","Goldsboro, North Carolina",1,0,"A faculty member was killed with a rifle in the school library of Wayne Community College. The suspected 20-year-old gunman, Kenneth Stancil, was arrested in Florida the next day. As of January 2017, Stancil, an admitted Neo-Nazi is being investigated for a hate crime.[512] Stancil was later sentenced to life without parole for the murder.[513]",0,0,1,2015-04-13,Goldsboro,North Carolina,"Goldsboro, North Carolina","Goldsboro, Wayne County, North Carolina, USA","Goldsboro, Wayne County, North Carolina, USA","(35.3848841, -77.9927651)",35.3848841,-77.9927651,4,2015,13
416,"April 16, 2015","Paradis, Louisiana",0,1,"A police officer was shot outside a school in a school zone while he was directing school buses into J.B. Martin Middle School, and the suspect was apprehended at the scene.[514]",0,0,1,2015-04-16,Paradis,Louisiana,"Paradis, Louisiana","Paradis, St. Charles Parish, Louisiana, 70080, USA","Paradis, St. Charles Parish, Louisiana, 70080, USA","(29.8796513, -90.4339715)",29.8796513,-90.4339715,4,2015,16
417,"May 12, 2015","Jacksonville, Florida",0,2,"Police report that a 16-year-old shot five bullets into a school bus and injured two students. Apparently, there was an argument that touched on previous events.[515]",0,0,2,2015-05-12,Jacksonville,Florida,"Jacksonville, Florida","Jacksonville, Duval County, Florida, USA","Jacksonville, Duval County, Florida, USA","(30.3321838, -81.655651)",30.3321838,-81.655651,5,2015,12
